{
  "schema_version": "1.0",
  "id": "task_05_ai_summary_validation",
  "title": "AI summary validation",
  "summary": "Validate structured generated output strictly and require identity and numeric fields to match supplied source facts.",
  "area": "structured-output",
  "tags": ["structured-output", "schema-validation", "source-grounding", "duplicate-detection"],
  "candidates": {"reference": "reference_solution.py", "flawed": "flawed_candidate.py"},
  "tests": "tests/test_cases.py",
  "review_notes": "evaluation_notes.md",
  "expected": {"reference": "pass_all", "flawed": "fail_at_least_one"},
  "known_limits": ["Free-form note text is not fact-checked and still requires human review.", "No LLM call is made."]
}
