{
  "schema_version": "1.0",
  "id": "task_03_user_quota",
  "title": "User quota",
  "summary": "Deduct quota safely while preserving idempotent retry identity, original responses, and single-process concurrency.",
  "area": "state-and-retry",
  "tags": ["idempotency", "retry-semantics", "concurrency", "state"],
  "candidates": {"reference": "reference_solution.py", "flawed": "flawed_candidate.py"},
  "tests": "tests/test_cases.py",
  "review_notes": "evaluation_notes.md",
  "expected": {"reference": "pass_all", "flawed": "fail_at_least_one"},
  "known_limits": ["State is process-local and does not provide durable or multi-worker coordination."]
}
